title,url
What songs sound like this image?,https://www.reddit.com/r/ifyoulikeblank/comments/saz0bx/what_songs_sound_like_this_image/
[IIL] music that feels like this image [WEWIL],https://www.reddit.com/r/ifyoulikeblank/comments/wlnsfr/iil_music_that_feels_like_this_image_wewil/
"IIL the scenery from this image, what songs will I like?",https://www.reddit.com/r/ifyoulikeblank/comments/12lnov3/iil_the_scenery_from_this_image_what_songs_will_i/
[IIL] music that has the same vibe as this image,https://www.reddit.com/r/ifyoulikeblank/comments/12lb7fw/iil_music_that_has_the_same_vibe_as_this_image/
[IIL] songs that feels like this image [WEWIL],https://www.reddit.com/r/ifyoulikeblank/comments/18jb1e6/iil_songs_that_feels_like_this_image_wewil/
[IIL] music that has the same vibe as this image like Jail by Down for example,https://www.reddit.com/r/ifyoulikeblank/comments/125ee75/iil_music_that_has_the_same_vibe_as_this_image/
IIL this dream land image WEWIL?,https://www.reddit.com/r/ifyoulikeblank/comments/rc7gsn/iil_this_dream_land_image_wewil/
IIL artworks like this image:,https://www.reddit.com/r/ifyoulikeblank/comments/154dhpi/iil_artworks_like_this_image/
songs like this image?,https://www.reddit.com/r/ifyoulikeblank/comments/t5acsl/songs_like_this_image/
What songs sound like this image?,https://www.reddit.com/r/ifyoulikeblank/comments/sbobgw/what_songs_sound_like_this_image/
"What songs sound like this image? ✨ Thank you all for your response on my last post. I’ve made a dedicated subreddit for this sort of content, r/PictureTheSound ✨ Hopefully see you there 🙏",https://www.reddit.com/r/ifyoulikeblank/comments/scgb0c/what_songs_sound_like_this_image_thank_you_all/
[IIL] music that has the same vibe as this image? Losstime by Creepy Nuts for example,https://www.reddit.com/r/ifyoulikeblank/comments/12vidlf/iil_music_that_has_the_same_vibe_as_this_image/
"if i like images with this sort of aura, what else will i like",https://www.reddit.com/r/ifyoulikeblank/comments/i0pzdr/if_i_like_images_with_this_sort_of_aura_what_else/
"If I like the moody, almost melancholy aesthetic of this image, what are some subreddits I might enjoy that post similar content?",https://www.reddit.com/r/ifyoulikeblank/comments/pr2f02/if_i_like_the_moody_almost_melancholy_aesthetic/
[IIL] Everything on this image [WEWIL] in terms of classic novels I could read for 12U English,https://www.reddit.com/r/ifyoulikeblank/comments/sn93pd/iil_everything_on_this_image_wewil_in_terms_of/
"IIL this, WEWIL. (had to do 2 pictures because an ad blocked part of the image)",https://www.reddit.com/r/ifyoulikeblank/comments/wfhnqd/iil_this_wewil_had_to_do_2_pictures_because_an_ad/
"Hey everyone! Thank you all for your response on my post “what songs sound like this image?”. A few of you suggested a dedicated subreddit for this, so I’ve made one! Hopefully see you there 🙏",https://www.reddit.com/r/ifyoulikeblank/comments/sbo6dp/hey_everyone_thank_you_all_for_your_response_on/
"IIL scenic game wallpapers like this Skyrim one, can someone point me to a image database or google search query for similar wallpapers",https://www.reddit.com/r/ifyoulikeblank/comments/opr9hc/iil_scenic_game_wallpapers_like_this_skyrim_one/
[IIL] This poster/image [WEWIL]?,https://www.reddit.com/r/ifyoulikeblank/comments/tpfr7/iil_this_posterimage_wewil/
[Art] IIL This picture/image/art WEWIL?,https://www.reddit.com/r/ifyoulikeblank/comments/mswae/art_iil_this_pictureimageart_wewil/
"[iil] The cover for 'rom com 2004' by Soccer Mommy, what other images might I like?",https://www.reddit.com/r/ifyoulikeblank/comments/x32bpg/iil_the_cover_for_rom_com_2004_by_soccer_mommy/
"WEWIL - IIL surreal photography/portraits, what artists/pieces would I like?",https://www.reddit.com/r/ifyoulikeblank/comments/iqtjr7/wewil_iil_surreal_photographyportraits_what/
"[IIL] Body types like these two models (though one is heavily photoshopped), Who else might I like? [WEWIL]",https://www.reddit.com/r/ifyoulikeblank/comments/2lnyl0/iil_body_types_like_these_two_models_though_one/
[IIL] The paintings/drawings of Ken Price [WEWIL],https://www.reddit.com/r/ifyoulikeblank/comments/672znm/iil_the_paintingsdrawings_of_ken_price_wewil/
"Idk if this is allowed in this sub, but what albums sound like this picture?",https://www.reddit.com/r/ifyoulikeblank/comments/rjkgo4/idk_if_this_is_allowed_in_this_sub_but_what/
"IIL Movie/Tv shows scenes where someone is thinking about a person they love and then see a creative image of them. Like, not the exact image of them, but some kind of fantasy",https://www.reddit.com/r/ifyoulikeblank/comments/qt9zo9/iil_movietv_shows_scenes_where_someone_is/
"IIL those super grainy oversaturated memes, what image editing apps WIL for making them?",https://www.reddit.com/r/ifyoulikeblank/comments/fdq8k6/iil_those_super_grainy_oversaturated_memes_what/
songs that sound like these images?,https://www.reddit.com/r/ifyoulikeblank/comments/s38pee/songs_that_sound_like_these_images/
[IIL] Music that sounds like this photo,https://www.reddit.com/r/ifyoulikeblank/comments/zrdw74/iil_music_that_sounds_like_this_photo/
Inspired by u/BruhNoWhy2742 ‘s post…what songs sound like this picture?,https://www.reddit.com/r/ifyoulikeblank/comments/rjwfhn/inspired_by_ubruhnowhy2742_s_postwhat_songs_sound/
Songs that sound like this picture,https://www.reddit.com/r/ifyoulikeblank/comments/s47t6g/songs_that_sound_like_this_picture/
[IIL]music that feels like this photograph,https://www.reddit.com/r/ifyoulikeblank/comments/wnacbt/iilmusic_that_feels_like_this_photograph/
[IIL]Music that feels like this photograph,https://www.reddit.com/r/ifyoulikeblank/comments/z88if5/iilmusic_that_feels_like_this_photograph/
[IIL]music that feels like this photograph,https://www.reddit.com/r/ifyoulikeblank/comments/13a3ze6/iilmusic_that_feels_like_this_photograph/
What else would i like if i adore the feeling that this photo gives me. Looking for similar photos with that eerie feel that old architecture and space gives you.,https://www.reddit.com/r/ifyoulikeblank/comments/ooyhhs/what_else_would_i_like_if_i_adore_the_feeling/
"IIL this picture of a cat on a spaceship, WEWIL?",https://www.reddit.com/r/ifyoulikeblank/comments/ugn7mu/iil_this_picture_of_a_cat_on_a_spaceship_wewil/
"[IIL] PowerPoint for its ease of use in creating or modifying images with shapes, but I need something that will handle large or high-resolution images, [WEWIL]?",https://www.reddit.com/r/ifyoulikeblank/comments/j3gh1y/iil_powerpoint_for_its_ease_of_use_in_creating_or/
IIL this picture WEWIL,https://www.reddit.com/r/ifyoulikeblank/comments/v1vjgx/iil_this_picture_wewil/
"[IIL] the artists in this picture, [WEWIL?]",https://www.reddit.com/r/ifyoulikeblank/comments/u7gmv1/iil_the_artists_in_this_picture_wewil/
"If I like the ambience in this picture; the starry night sky, the moon-lit meadows, the crescent moon and the warmth of the wooden house, what Books, Short-Stories, Films and Short-films would you recommend?",https://www.reddit.com/r/ifyoulikeblank/comments/p5e7ua/if_i_like_the_ambience_in_this_picture_the_starry/
IIL this trope in the given picture then WEWIL?,https://www.reddit.com/r/ifyoulikeblank/comments/r4l2uz/iil_this_trope_in_the_given_picture_then_wewil/
Besides the Weeknd’s new album what are some songs that you picture playing in this setting?,https://www.reddit.com/r/ifyoulikeblank/comments/s037tq/besides_the_weeknds_new_album_what_are_some_songs/
What pictures/art would I like if I'm in love with my fridge magnet? I love everything about this. More info in comments.,https://www.reddit.com/r/ifyoulikeblank/comments/s4axay/what_picturesart_would_i_like_if_im_in_love_with/
"[IYL] Russian / US Rap, aliens and cool pictures [YML] this Mixtape I made",https://www.reddit.com/r/ifyoulikeblank/comments/e7l6o9/iyl_russian_us_rap_aliens_and_cool_pictures_yml/
IIL movies with buildings that have brown bricks - like Fences and Rear Window aesthetic [pictures inside],https://www.reddit.com/r/ifyoulikeblank/comments/16zvbif/iil_movies_with_buildings_that_have_brown_bricks/
Can someone recommend me some music based on some pictures?,https://www.reddit.com/r/ifyoulikeblank/comments/5cbk3h/can_someone_recommend_me_some_music_based_on_some/
"[IIL] Modernly imagined 80s/90s kinda over the top setting/style/imagery like in Stranger Things Season 3 (or possibly some elements of Gravity Falls), WEWIL? Visual media; movies, series, computer games...",https://www.reddit.com/r/ifyoulikeblank/comments/yuc1ws/iil_modernly_imagined_80s90s_kinda_over_the_top/
"[IIL] these album covers that have a picture of a road, [WEWIL]?",https://www.reddit.com/r/ifyoulikeblank/comments/hgax3p/iil_these_album_covers_that_have_a_picture_of_a/
"[IIL] ‘Carrier’, a podcast that feels like a picture-less movie, with a full soundscape and good voice acting, [WEWIL?]",https://www.reddit.com/r/ifyoulikeblank/comments/ckvlin/iil_carrier_a_podcast_that_feels_like_a/
"[IIL] this style of photography, [WEWIL]?",https://www.reddit.com/r/ifyoulikeblank/comments/1ltr3q/iil_this_style_of_photography_wewil/
What songs sound like these pictures?,https://www.reddit.com/r/ifyoulikeblank/comments/saa91i/what_songs_sound_like_these_pictures/
songs that sound like these pictures?,https://www.reddit.com/r/ifyoulikeblank/comments/sbez8i/songs_that_sound_like_these_pictures/
"IIL songs that sound like how these pictures feel, WWIL?",https://www.reddit.com/r/ifyoulikeblank/comments/ttus2t/iil_songs_that_sound_like_how_these_pictures_feel/
"IIL shows that gives me the feeling shown from the picture below like Breaking Bad and Succession, WEWIL?",https://www.reddit.com/r/ifyoulikeblank/comments/yim4fe/iil_shows_that_gives_me_the_feeling_shown_from/
[IIL] this photo of a girl pointing a gun at her shadow [WEWIL],https://www.reddit.com/r/ifyoulikeblank/comments/zx9spy/iil_this_photo_of_a_girl_pointing_a_gun_at_her/
IIL photographers/artists/etc who do coloring like this. Im obssessed with colors like this and would like to see more like it. The first two photos are photos I shot and edited and the last one is an album cover in the style I would like to see. Good album btw,https://www.reddit.com/r/ifyoulikeblank/comments/10non2m/iil_photographersartistsetc_who_do_coloring_like/
"Hey guys, do you have more photos like this, rare and unique sport photos, or do you know place, subreddit where i can find it or ask people and they send photos in comment?",https://www.reddit.com/r/ifyoulikeblank/comments/agey5m/hey_guys_do_you_have_more_photos_like_this_rare/
"[IYL] finding movies based on a certain feeling or imagery, you might want to check out this new subreddit",https://www.reddit.com/r/ifyoulikeblank/comments/nuh5vw/iyl_finding_movies_based_on_a_certain_feeling_or/
Filmakers/photographers like Larry Clark,https://www.reddit.com/r/ifyoulikeblank/comments/3b5x03/filmakersphotographers_like_larry_clark/
What songs sound like these photos?,https://www.reddit.com/r/ifyoulikeblank/comments/sbcled/what_songs_sound_like_these_photos/
"[IIL] this, [WEWIL?] (Generally listening in background when jogging, drawing etc...)",https://www.reddit.com/r/ifyoulikeblank/comments/pkt7ff/iil_this_wewil_generally_listening_in_background/
New focus/drawing music [IIL] Lo-fi and emotion evoking stuff [WEWIL?],https://www.reddit.com/r/ifyoulikeblank/comments/bibvyh/new_focusdrawing_music_iil_lofi_and_emotion/
"Playlist for drawing, with a swelling and fluttering sound (Doors, LCD Soundsystem, Nils Frahm)",https://www.reddit.com/r/ifyoulikeblank/comments/cetfpy/playlist_for_drawing_with_a_swelling_and/
"IIL stories that include multiple people being in one body but arent really about the mental illness DID like ""jekyll and Hyde"" and stepehn kings the drawing of the three WEWIL",https://www.reddit.com/r/ifyoulikeblank/comments/z1pc8h/iil_stories_that_include_multiple_people_being_in/
"If I like practicing drawing, knitting, yoga, flute and rowing, what other hobbies will I like?",https://www.reddit.com/r/ifyoulikeblank/comments/il06sk/if_i_like_practicing_drawing_knitting_yoga_flute/
"Painting or drawing videos recorded by someone, without background music",https://www.reddit.com/r/ifyoulikeblank/comments/deigv6/painting_or_drawing_videos_recorded_by_someone/
